{
  "qeva_version": "0.2",
  "id": "qeva:1:type",
  "revision": 1,
  "kind": "primitive",
  "title": "Type",
  "summary": "A type classifies expressions and states which constructions may be formed with them.",
  "domains": [
    "type-theory",
    "foundations"
  ],
  "context": {
    "framework": "type theory",
    "framework_ref": null,
    "note": "This node belongs to one explicit foundational presentation; alternate foundations may encode it differently."
  },
  "assumptions": [
    {
      "text": "The declared type theory context is fixed.",
      "ref": null
    }
  ],
  "content": {
    "plain": "A type classifies expressions and states which constructions may be formed with them.",
    "exact": "Judgments such as a:A assert that term a has type A; formation, introduction, elimination, and computation rules define each type constructor.",
    "example": "n:ℕ records that n is a natural-number term.",
    "caveat": "Types are not always sets, though some models interpret them set-theoretically."
  },
  "dependencies": [
    "qeva:1:expression@1"
  ],
  "relations": [],
  "verification": {
    "level": "editorial",
    "method": "QEVA seed formulation reviewed for internal mathematical coherence; no external formal proof is claimed.",
    "artifact": null
  },
  "provenance": {
    "created": "2026-09-04",
    "creator": "QEVA foundation seed",
    "license": "CC0-1.0",
    "source_note": "Original QEVA orientation record. It is a compact map entry, not a substitute for a textbook or primary source."
  },
  "supersedes": null,
  "legacy_ids": []
}
