{
  "qeva_version": "0.2",
  "id": "qeva:1:object",
  "revision": 1,
  "kind": "primitive",
  "title": "Object",
  "summary": "An object is whatever a chosen mathematical discourse permits us to refer to as one thing.",
  "domains": [
    "foundations",
    "ontology"
  ],
  "context": {
    "framework": "preformal metalanguage",
    "framework_ref": null,
    "note": "This node belongs to one explicit foundational presentation; alternate foundations may encode it differently."
  },
  "assumptions": [
    {
      "text": "The declared preformal metalanguage context is fixed.",
      "ref": null
    }
  ],
  "content": {
    "plain": "An object is whatever a chosen mathematical discourse permits us to refer to as one thing.",
    "exact": "Object is a role in a framework, not a universal substance. A framework supplies a domain U of admissible referents and rules for forming or recognizing them.",
    "example": "A number, function, proof, graph, or group may each be an object in a suitable framework.",
    "caveat": "Different foundations encode the same informal object differently."
  },
  "dependencies": [
    "qeva:1:distinction@1"
  ],
  "relations": [],
  "verification": {
    "level": "editorial",
    "method": "QEVA seed formulation reviewed for internal mathematical coherence; no external formal proof is claimed.",
    "artifact": null
  },
  "provenance": {
    "created": "2026-09-04",
    "creator": "QEVA foundation seed",
    "license": "CC0-1.0",
    "source_note": "Original QEVA orientation record. It is a compact map entry, not a substitute for a textbook or primary source."
  },
  "supersedes": null,
  "legacy_ids": []
}
