{
  "qeva_version": "0.2",
  "id": "qeva:1:rational",
  "revision": 1,
  "kind": "definition",
  "title": "Rational number",
  "summary": "Rational numbers represent ratios of integers with nonzero denominator.",
  "domains": [
    "number-theory",
    "algebra"
  ],
  "context": {
    "framework": "field of fractions",
    "framework_ref": null,
    "note": "This node belongs to one explicit foundational presentation; alternate foundations may encode it differently."
  },
  "assumptions": [
    {
      "text": "The declared field of fractions context is fixed.",
      "ref": null
    }
  ],
  "content": {
    "plain": "Rational numbers represent ratios of integers with nonzero denominator.",
    "exact": "ℚ may be constructed from pairs (a,b)∈ℤ×(ℤ\\{0}) modulo (a,b)~(c,d) iff ad=bc.",
    "example": "(1,2) and (2,4) represent the same rational number.",
    "caveat": "A written decimal need not be rational unless its expansion eventually repeats."
  },
  "dependencies": [
    "qeva:1:integer@1",
    "qeva:1:equivalence@2",
    "qeva:1:multiplication@1"
  ],
  "relations": [],
  "verification": {
    "level": "editorial",
    "method": "QEVA seed formulation reviewed for internal mathematical coherence; no external formal proof is claimed.",
    "artifact": null
  },
  "provenance": {
    "created": "2026-09-04",
    "creator": "QEVA foundation seed",
    "license": "CC0-1.0",
    "source_note": "Original QEVA orientation record. It is a compact map entry, not a substitute for a textbook or primary source."
  },
  "supersedes": null,
  "legacy_ids": []
}
