{
  "qeva_version": "0.2",
  "id": "qeva:1:successor",
  "revision": 1,
  "kind": "primitive",
  "title": "Successor",
  "summary": "Successor moves from one natural number to the next.",
  "domains": [
    "number-theory",
    "arithmetic"
  ],
  "context": {
    "framework": "natural-number arithmetic",
    "framework_ref": null,
    "note": "This node belongs to one explicit foundational presentation; alternate foundations may encode it differently."
  },
  "assumptions": [
    {
      "text": "The declared natural-number arithmetic context is fixed.",
      "ref": null
    }
  ],
  "content": {
    "plain": "Successor moves from one natural number to the next.",
    "exact": "A Peano-style successor S:N→N is injective and never maps any n to 0.",
    "example": "S(0) is written 1; S(S(0)) is written 2.",
    "caveat": "The properties of successor come from the chosen arithmetic axioms."
  },
  "dependencies": [
    "qeva:1:operation@1",
    "qeva:1:zero@1"
  ],
  "relations": [],
  "verification": {
    "level": "editorial",
    "method": "QEVA seed formulation reviewed for internal mathematical coherence; no external formal proof is claimed.",
    "artifact": null
  },
  "provenance": {
    "created": "2026-09-04",
    "creator": "QEVA foundation seed",
    "license": "CC0-1.0",
    "source_note": "Original QEVA orientation record. It is a compact map entry, not a substitute for a textbook or primary source."
  },
  "supersedes": null,
  "legacy_ids": []
}
