{
  "qeva_version": "0.2",
  "id": "qeva:1:dependent-type-theory",
  "revision": 1,
  "kind": "framework",
  "title": "Dependent type theory",
  "summary": "Dependent types may vary with terms, letting statements and proofs live in one typed language.",
  "domains": [
    "type-theory",
    "foundations",
    "proof"
  ],
  "context": {
    "framework": "type theory",
    "framework_ref": null,
    "note": "This node belongs to one explicit foundational presentation; alternate foundations may encode it differently."
  },
  "assumptions": [
    {
      "text": "The declared type theory context is fixed.",
      "ref": null
    }
  ],
  "content": {
    "plain": "Dependent types may vary with terms, letting statements and proofs live in one typed language.",
    "exact": "A dependent product Π(x:A).B(x) generalizes functions and universal propositions; a dependent sum Σ(x:A).B(x) packages a witness with data depending on it.",
    "example": "A vector type Vec(A,n) records its length n in the type.",
    "caveat": "There are many dependent type theories with different equality, universe, and extensionality rules."
  },
  "dependencies": [
    "qeva:1:type@1",
    "qeva:1:proof@1",
    "qeva:1:function@1"
  ],
  "relations": [],
  "verification": {
    "level": "editorial",
    "method": "QEVA seed formulation reviewed for internal mathematical coherence; no external formal proof is claimed.",
    "artifact": null
  },
  "provenance": {
    "created": "2026-09-04",
    "creator": "QEVA foundation seed",
    "license": "CC0-1.0",
    "source_note": "Original QEVA orientation record. It is a compact map entry, not a substitute for a textbook or primary source."
  },
  "supersedes": null,
  "legacy_ids": []
}
