{
  "qeva_version": "0.2",
  "id": "qeva:1:continuity",
  "revision": 1,
  "kind": "definition",
  "title": "Continuity",
  "summary": "Continuity formalizes preservation of nearness or open-set structure under a map.",
  "domains": [
    "analysis",
    "topology",
    "dynamics"
  ],
  "context": {
    "framework": "topology",
    "framework_ref": null,
    "note": "Framework is named textually in this seed release; full recursive first-principles closure remains future work."
  },
  "assumptions": [
    {
      "text": "Topological spaces X and Y and a function f:X→Y are specified.",
      "ref": null
    }
  ],
  "content": {
    "plain": "A continuous map does not tear apart the chosen topology: inverse images of observable open regions remain open.",
    "exact": "f:X→Y is continuous iff for every open V⊆Y, f^{-1}(V) is open in X. In metric spaces this is equivalent to the ε-δ definition.",
    "example": "f(x)=x^2 is continuous on R with its usual topology.",
    "caveat": "Continuity is relative to the chosen topologies; a function can be continuous under one topology and not another."
  },
  "dependencies": [],
  "relations": [
    {
      "kind": "used-in",
      "target": "qeva:1:stability@1",
      "note": "Many stability notions are formulated using neighborhoods or metrics."
    },
    {
      "kind": "contrasts",
      "target": "qeva:1:discreteness@1",
      "note": "Discrete spaces make every function out of them continuous."
    }
  ],
  "verification": {
    "level": "editorial",
    "method": "QEVA seed formulation checked editorially for mathematical coherence; no external formal proof artifact is claimed.",
    "artifact": null
  },
  "provenance": {
    "created": "2026-09-04",
    "creator": "QEVA seed archive",
    "license": "CC0-1.0",
    "source_note": "Seed record for the QEVA machinery map. It is not claimed to be the unique foundational presentation of this concept."
  },
  "supersedes": null,
  "legacy_ids": []
}
