{
  "qeva_version": "0.2",
  "id": "qeva:1:inference-rule",
  "revision": 1,
  "kind": "inference-rule",
  "title": "Inference rule",
  "summary": "An inference rule licenses a transition from specified premises to a conclusion.",
  "domains": [
    "logic",
    "proof"
  ],
  "context": {
    "framework": "formal proof system",
    "framework_ref": null,
    "note": "This node belongs to one explicit foundational presentation; alternate foundations may encode it differently."
  },
  "assumptions": [
    {
      "text": "The declared formal proof system context is fixed.",
      "ref": null
    }
  ],
  "content": {
    "plain": "An inference rule licenses a transition from specified premises to a conclusion.",
    "exact": "A rule is a schema Γ/P whose instances permit P to be appended to a derivation whenever the required premises Γ are available under the declared side conditions.",
    "example": "Modus ponens licenses Q from P and P→Q after the formulas and variables are matched correctly.",
    "caveat": "A rule's soundness depends on a semantics; its syntactic admissibility does not prove that soundness."
  },
  "dependencies": [
    "qeva:1:statement@1"
  ],
  "relations": [],
  "verification": {
    "level": "editorial",
    "method": "QEVA seed formulation reviewed for internal mathematical coherence; no external formal proof is claimed.",
    "artifact": null
  },
  "provenance": {
    "created": "2026-09-04",
    "creator": "QEVA foundation seed",
    "license": "CC0-1.0",
    "source_note": "Original QEVA orientation record. It is a compact map entry, not a substitute for a textbook or primary source."
  },
  "supersedes": null,
  "legacy_ids": []
}
