{
  "qeva_version": "0.2",
  "id": "qeva:1:prime",
  "revision": 1,
  "kind": "definition",
  "title": "Prime number",
  "summary": "A positive integer greater than 1 with no positive divisors other than 1 and itself.",
  "domains": [
    "number",
    "arithmetic"
  ],
  "context": {
    "framework": "positive integers with ordinary multiplication and divisibility",
    "framework_ref": null,
    "note": "Context is named textually in this seed release; its foundations are not yet recursively expanded into QEVA records."
  },
  "assumptions": [],
  "content": {
    "plain": "A prime cannot be factored into two smaller positive integers greater than 1.",
    "exact": "For p in Z with p>1, p is prime iff for every positive integer d, d divides p implies d=1 or d=p.",
    "example": "7 is prime. 12 is not prime because 3 divides 12 and 3 is neither 1 nor 12.",
    "caveat": "This seed record uses the standard positive-integer definition; “prime elements” in general rings require separate contextual definitions."
  },
  "dependencies": [],
  "relations": [],
  "verification": {
    "level": "editorial",
    "method": "QEVA seed formulation checked editorially for mathematical coherence; no external formal proof artifact is claimed.",
    "artifact": null
  },
  "provenance": {
    "created": "2026-09-04",
    "creator": "QEVA seed archive",
    "license": "CC0-1.0",
    "source_note": "Seed record written to demonstrate QEVA Protocol 0.1; it is not claimed to be the unique foundational presentation of this concept."
  },
  "supersedes": null,
  "legacy_ids": [
    "qeva:1:definition:prime"
  ]
}
