{
  "qeva_version": "0.2",
  "id": "qeva:1:expression",
  "revision": 1,
  "kind": "definition",
  "title": "Expression",
  "summary": "An expression is a finite arrangement of symbols built by explicit formation rules.",
  "domains": [
    "foundations",
    "language"
  ],
  "context": {
    "framework": "formal language",
    "framework_ref": null,
    "note": "This node belongs to one explicit foundational presentation; alternate foundations may encode it differently."
  },
  "assumptions": [
    {
      "text": "The declared formal language context is fixed.",
      "ref": null
    }
  ],
  "content": {
    "plain": "An expression is a finite arrangement of symbols built by explicit formation rules.",
    "exact": "Given an alphabet Σ and a grammar G, Expr(G) is the least class containing the atomic expressions and closed under the constructors declared by G.",
    "example": "If x and y are terms and + is binary, +(x,y) may be a well-formed term.",
    "caveat": "Well-formedness is syntax; it does not guarantee meaning or truth."
  },
  "dependencies": [
    "qeva:1:symbol@1"
  ],
  "relations": [],
  "verification": {
    "level": "editorial",
    "method": "QEVA seed formulation reviewed for internal mathematical coherence; no external formal proof is claimed.",
    "artifact": null
  },
  "provenance": {
    "created": "2026-09-04",
    "creator": "QEVA foundation seed",
    "license": "CC0-1.0",
    "source_note": "Original QEVA orientation record. It is a compact map entry, not a substitute for a textbook or primary source."
  },
  "supersedes": null,
  "legacy_ids": []
}
