{
  "qeva_version": "0.2",
  "id": "qeva:1:statement",
  "revision": 1,
  "kind": "definition",
  "title": "Statement",
  "summary": "A statement is an expression eligible to be asserted, denied, proved, or evaluated in a model.",
  "domains": [
    "logic",
    "language"
  ],
  "context": {
    "framework": "formal language",
    "framework_ref": null,
    "note": "This node belongs to one explicit foundational presentation; alternate foundations may encode it differently."
  },
  "assumptions": [
    {
      "text": "The declared formal language context is fixed.",
      "ref": null
    }
  ],
  "content": {
    "plain": "A statement is an expression eligible to be asserted, denied, proved, or evaluated in a model.",
    "exact": "For a language L, Sent(L) is the class of closed well-formed formulas: formulas with no free variables.",
    "example": "∀x (x=x) is a sentence in a language with equality.",
    "caveat": "The same written string may fail to be a statement in another grammar."
  },
  "dependencies": [
    "qeva:1:expression@1"
  ],
  "relations": [],
  "verification": {
    "level": "editorial",
    "method": "QEVA seed formulation reviewed for internal mathematical coherence; no external formal proof is claimed.",
    "artifact": null
  },
  "provenance": {
    "created": "2026-09-04",
    "creator": "QEVA foundation seed",
    "license": "CC0-1.0",
    "source_note": "Original QEVA orientation record. It is a compact map entry, not a substitute for a textbook or primary source."
  },
  "supersedes": null,
  "legacy_ids": []
}
