{
  "qeva_version": "0.2",
  "id": "qeva:1:parity",
  "revision": 2,
  "kind": "definition",
  "title": "Parity",
  "summary": "Classification of integers by their remainder modulo 2.",
  "domains": [
    "number",
    "arithmetic"
  ],
  "context": {
    "framework": "integers with ordinary arithmetic",
    "framework_ref": "qeva:1:integer@1",
    "note": "Revision 2 exposes a QEVA foundation dependency instead of stopping only at a textual framework label."
  },
  "assumptions": [],
  "content": {
    "plain": "Every integer belongs to one of two classes: even or odd.",
    "exact": "For n in Z: n is even iff there exists k in Z with n=2k. n is odd iff there exists k in Z with n=2k+1.",
    "example": "18 is even because 18=2·9. 19 is odd because 19=2·9+1.",
    "caveat": "Parity here is the modulo-two classification of integers; it does not make every two-state distinction an arithmetic parity."
  },
  "dependencies": [
    "qeva:1:equivalence@2",
    "qeva:1:integer@1"
  ],
  "relations": [
    {
      "kind": "instance-of",
      "target": "qeva:1:equivalence@2",
      "note": "Parity classes arise from congruence modulo 2."
    }
  ],
  "verification": {
    "level": "editorial",
    "method": "Revision migration checked for exact-reference closure and editorial mathematical coherence; no external formal proof artifact is claimed.",
    "artifact": null
  },
  "provenance": {
    "created": "2026-09-04",
    "creator": "QEVA foundation migration",
    "license": "CC0-1.0",
    "source_note": "Supersedes the preserved release-0.3 seed revision by connecting its previously textual framework boundary to the QEVA foundation switchboard."
  },
  "supersedes": "qeva:1:parity@1",
  "legacy_ids": [
    "qeva:1:definition:parity"
  ]
}
