{
  "qeva_version": "0.2",
  "id": "qeva:1:axiom-choice",
  "revision": 1,
  "kind": "axiom",
  "title": "Axiom of choice",
  "summary": "A simultaneous choice can be made from every member of a family of nonempty sets.",
  "domains": [
    "set-theory",
    "foundations"
  ],
  "context": {
    "framework": "classical first-order set theory",
    "framework_ref": null,
    "note": "This node belongs to one explicit foundational presentation; alternate foundations may encode it differently."
  },
  "assumptions": [
    {
      "text": "The declared classical first-order set theory context is fixed.",
      "ref": null
    }
  ],
  "content": {
    "plain": "A simultaneous choice can be made from every member of a family of nonempty sets.",
    "exact": "One formulation: every set A of nonempty sets has a function f with domain A such that f(x)∈x for every x∈A.",
    "example": "For a finite family, choices can be made without the full axiom; the axiom governs arbitrary families.",
    "caveat": "Choice has many equivalent forms in ZF and consequences that may be nonconstructive; weaker and stronger variants must be named."
  },
  "dependencies": [
    "qeva:1:function@1",
    "qeva:1:set@1",
    "qeva:1:membership@1",
    "qeva:1:axiom@1"
  ],
  "relations": [],
  "verification": {
    "level": "editorial",
    "method": "QEVA seed formulation reviewed for internal mathematical coherence; no external formal proof is claimed.",
    "artifact": null
  },
  "provenance": {
    "created": "2026-09-04",
    "creator": "QEVA foundation seed",
    "license": "CC0-1.0",
    "source_note": "Original QEVA orientation record. It is a compact map entry, not a substitute for a textbook or primary source."
  },
  "supersedes": null,
  "legacy_ids": []
}
