{
  "qeva_version": "0.2",
  "id": "qeva:1:exploration-exploitation",
  "revision": 2,
  "kind": "definition",
  "title": "Exploration–exploitation tradeoff",
  "summary": "Sequential decision systems often trade using current best information against actions that improve information about alternatives.",
  "domains": [
    "optimization",
    "learning",
    "decision-theory"
  ],
  "context": {
    "framework": "sequential decision theory",
    "framework_ref": "qeva:1:probability-space@1",
    "note": "Revision 2 exposes a QEVA foundation dependency instead of stopping only at a textual framework label."
  },
  "assumptions": [
    {
      "text": "A sequential objective, uncertainty model, action set, and information process are specified.",
      "ref": null
    }
  ],
  "content": {
    "plain": "Exploitation uses what currently looks best; exploration spends effort learning whether something else is better.",
    "exact": "In a multi-armed bandit, exploitation selects an arm with high current estimated reward while exploration samples uncertain arms to improve future decisions. Formal optimal policies depend on the stochastic model and horizon.",
    "example": "An ε-greedy policy chooses the currently best arm with probability 1-ε and explores otherwise.",
    "caveat": "There is no universal optimal oscillation schedule. The correct balance depends on uncertainty, objective, horizon, costs, and dynamics."
  },
  "dependencies": [
    "qeva:1:optimization@2",
    "qeva:1:probability-space@1"
  ],
  "relations": [
    {
      "kind": "addresses",
      "target": "qeva:1:local-global@2",
      "note": "Exploration can mitigate local or informational traps in some search settings."
    }
  ],
  "verification": {
    "level": "editorial",
    "method": "Revision migration checked for exact-reference closure and editorial mathematical coherence; no external formal proof artifact is claimed.",
    "artifact": null
  },
  "provenance": {
    "created": "2026-09-04",
    "creator": "QEVA foundation migration",
    "license": "CC0-1.0",
    "source_note": "Supersedes the preserved release-0.3 seed revision by connecting its previously textual framework boundary to the QEVA foundation switchboard."
  },
  "supersedes": "qeva:1:exploration-exploitation@1",
  "legacy_ids": []
}
